<?xml version="1.0" encoding="UTF-8"?>
<!DOCTYPE fiche SYSTEM "fiche.dtd" >
<fiche>
  <personnage>
    <nom>nom</nom>
    <poid>poid</poid>
    <taille>taille</taille>
    <age>age</age>
    <concept>concept</concept>
    <info>
      <nom>nom</nom>
      <valeur>valeur</valeur>
    </info>
    <xp>xp</xp>
  </personnage>
  <caracteristiquesPrincipales>
    <caracteristique>
      <nom>nom</nom>
      <valeur>valeur</valeur>
      <jauge/>
      <consommable>true</consommable>
    </caracteristique>
  </caracteristiquesPrincipales>
  <caracteristiquesSecondaire/>
  <competences/>
  <pouvoirs/>
  <barreDeVie/>
  <equipement/>
  <divers/>
</fiche>
